weekNumber,dayOfWeek,dateKey,title,declared,actual,diff
1,1,2026-01-01,A Fresh Start Can Happen Anytime,511,511,0
1,2,2026-01-02,"Intentions, Not Pressure",488,488,0
1,3,2026-01-03,Why Starting Again Works,517,517,0
1,4,2026-01-04,Letting Go to Begin Again,516,516,0
2,1,2026-01-05,The Perfect Morning,456,456,0
2,2,2026-01-06,The Early Bird Advantage,471,471,0
2,3,2026-01-07,Breakfast Conversations,450,450,0
2,4,2026-01-08,Moving Your Body at Dawn,476,476,0
2,5,2026-01-09,Mindful Mornings,449,449,0
2,6,2026-01-10,The Art of the Slow Morning,488,488,0
2,7,2026-01-11,When Routines Go Wrong,463,463,0
3,1,2026-01-12,Getting Around: Commute Stories,436,436,0
3,2,2026-01-13,Walking and Cycling to Work,491,491,0
3,3,2026-01-14,Remote Work Days,495,495,0
3,4,2026-01-15,Commuting Etiquette,488,488,0
3,5,2026-01-16,Driving to Work,454,454,0
3,6,2026-01-17,Long-Distance Commuters,474,474,0
3,7,2026-01-18,The Future of Getting to Work,468,468,0
4,1,2026-01-19,Where I Live: Describing Your Home,512,512,0
4,2,2026-01-20,Renting vs. Buying,486,486,0
4,3,2026-01-21,Decluttering and Minimalism,488,488,0
4,4,2026-01-22,Neighbors and Community,470,470,0
4,5,2026-01-23,Home Cooking and the Kitchen,497,497,0
4,6,2026-01-24,Interior Design and Personal Style,502,502,0
4,7,2026-01-25,"Home, Rest, and Reflection",544,544,0
5,1,2026-01-26,Why People Celebrate,476,476,0
5,2,2026-01-27,Traditions That Still Feel Alive,485,485,0
5,3,2026-01-28,Gifts and Giving,484,484,0
5,4,2026-01-29,Family Gatherings,487,487,0
5,5,2026-01-30,Food and Festival Memory,518,518,0
5,6,2026-01-31,"Music, Dance, and Celebration",517,517,0
5,7,2026-02-01,Carrying Celebration into Everyday Life,524,524,0
6,1,2026-02-02,Let's Eat: Food Preferences and Habits,495,495,0
6,2,2026-02-03,Eating Out and Restaurant Culture,552,552,0
6,3,2026-02-04,Street Food and Local Eats,489,489,0
6,4,2026-02-05,Healthy Eating and Diets,545,545,0
6,5,2026-02-06,Food Memories and Family Recipes,517,517,0
6,6,2026-02-07,International Cuisine and Fusion,548,548,0
6,7,2026-02-08,Food Trends and the Future of Eating,500,500,0
7,1,2026-02-09,The Weather Today,356,356,0
7,2,2026-02-10,Surviving the Rainy Season,358,358,0
7,3,2026-02-11,How Weather Shapes Culture,361,361,0
7,4,2026-02-12,Climate Anxiety and Everyday Action,397,397,0
7,5,2026-02-13,Storm Stories and Weather Memories,387,387,0
7,6,2026-02-14,Weather and Romance,403,403,0
7,7,2026-02-15,Dream Destinations by Season,375,375,0
8,1,2026-02-16,Spending Habits and What They Reveal,370,370,0
8,2,2026-02-17,Budgeting and the Art of Saving,431,431,0
8,3,2026-02-18,The Psychology of Spending,404,404,0
8,4,2026-02-19,Negotiating and Getting a Good Deal,406,406,0
8,5,2026-02-20,Financial Goals and Building a Future,414,414,0
8,6,2026-02-21,"Tipping, Gifting, and Money Etiquette",428,428,0
8,7,2026-02-22,The Future of Money,430,430,0
9,1,2026-02-23,Taking Care of Yourself,421,421,0
9,2,2026-02-24,Sleep and Recovery,447,447,0
9,3,2026-02-25,Mental Health at Work,446,446,0
9,4,2026-02-26,Eating Well Without Obsessing,437,437,0
9,5,2026-02-27,When You Get Sick,424,424,0
9,6,2026-02-28,Exercise and Finding What Works,452,452,0
9,7,2026-03-01,Building Lasting Health Habits,453,453,0
10,1,2026-03-02,My Week: Talking About Time and Schedules,429,429,0
10,2,2026-03-03,The Power of Morning Routines,485,485,0
10,3,2026-03-04,Managing Time at Work,436,436,0
10,4,2026-03-05,After Work: How We Spend Our Evenings,447,447,0
10,5,2026-03-06,"Weekends: Rest, Play, and Meaning",473,473,0
10,6,2026-03-07,Slow Living and Doing Less,490,490,0
10,7,2026-03-08,Women's Time: Invisible Labor and Reclaiming Your Hours,475,475,0
11,1,2026-03-09,Good Friends: What Makes a Great Friendship,472,472,0
11,2,2026-03-10,Making New Friends as an Adult,489,489,0
11,3,2026-03-11,Long-Distance Friendships,455,455,0
11,4,2026-03-12,Conflict and Repair in Friendship,501,501,0
11,5,2026-03-13,Friendship and Social Media,480,480,0
11,6,2026-03-14,What Makes a Best Friend,520,520,0
11,7,2026-03-15,Friendship Across Differences,462,462,0
12,1,2026-03-16,What Family Means Today,445,445,0
12,2,2026-03-17,Growing Up and Looking Back,470,470,0
12,3,2026-03-18,Siblings: Competition and Closeness,441,441,0
12,4,2026-03-19,Parenting Styles and Their Effects,427,427,0
12,5,2026-03-20,Caring for Aging Parents,442,442,0
12,6,2026-03-21,Family Conflict and How to Navigate It,499,499,0
12,7,2026-03-22,Creating New Family Traditions,446,446,0
13,1,2026-03-23,Colleagues and the Art of Working Together,451,451,0
13,2,2026-03-24,Managers and Being Managed,466,466,0
13,3,2026-03-25,Office Politics and How to Navigate Them,466,466,0
13,4,2026-03-26,Giving and Receiving Feedback,461,461,0
13,5,2026-03-27,Remote Teams and Digital Work Culture,453,453,0
13,6,2026-03-28,"Mentors, Role Models, and Who We Learn From",471,471,0
13,7,2026-03-29,Leaving a Job Gracefully,444,444,0
14,1,2026-03-30,Making Friends as an Adult,474,474,0
14,2,2026-03-31,Social Energy and Knowing Your Limits,446,446,0
14,3,2026-04-01,Small Talk and Why It Matters,454,454,0
14,4,2026-04-02,Group Dynamics and Belonging,475,475,0
14,5,2026-04-03,Social Media and Real Connection,447,447,0
14,6,2026-04-04,Loneliness and What Helps,469,469,0
14,7,2026-04-05,Building Community Where You Live,480,480,0
15,1,2026-04-06,Who Are You? Personality and Self-Understanding,459,459,0
15,2,2026-04-07,Introversion and Extroversion,451,451,0
15,3,2026-04-08,"Habits, Character, and Who We Choose to Be",472,472,0
15,4,2026-04-09,Confidence and Self-Doubt,451,451,0
15,5,2026-04-10,Curiosity as a Way of Life,488,488,0
15,6,2026-04-11,Humor and What It Reveals,469,469,0
15,7,2026-04-12,Growing Into Yourself Over Time,521,521,0
16,1,2026-04-13,The Art of Listening,434,434,0
16,2,2026-04-14,Saying What You Mean,477,477,0
16,3,2026-04-15,Non-Verbal Communication,443,443,0
16,4,2026-04-16,Navigating Difficult Conversations,441,441,0
16,5,2026-04-17,Writing Clearly in a World of Words,517,517,0
16,6,2026-04-18,Communicating Across Cultures,463,463,0
16,7,2026-04-19,When Words Are Not Enough,480,480,0
17,1,2026-04-20,What Kindness Actually Looks Like,491,491,0
17,2,2026-04-21,How to Help Someone Who Is Struggling,463,463,0
17,3,2026-04-22,Volunteering and Giving Back,471,471,0
17,4,2026-04-23,Gratitude and the Practice of Appreciation,485,485,0
17,5,2026-04-24,Setting Limits While Still Caring,495,495,0
17,6,2026-04-25,Being a Good Friend in Difficult Times,499,499,0
17,7,2026-04-26,The Ripple Effect of Small Acts,531,531,0
18,1,2026-04-27,Working It Out: How We Handle Disagreements,416,416,0
18,2,2026-04-28,Where Arguments Usually Begin,466,466,0
18,3,2026-04-29,How to Disagree Without Hurting the Relationship,479,479,0
18,4,2026-04-30,When an Apology Works and When It Does Not,500,500,0
18,5,2026-05-01,"Boundaries, Honesty, and Respect",491,491,0
18,6,2026-05-02,Repairing Trust After a Fight,478,478,0
18,7,2026-05-03,What Conflict Can Teach a Relationship,471,471,0
19,1,2026-05-04,What Do You Do? Identity and Work,459,459,0
19,2,2026-05-05,Choosing a Career Path,460,460,0
19,3,2026-05-06,The First Job and What It Teaches,481,481,0
19,4,2026-05-07,Changing Directions Mid-Career,489,489,0
19,5,2026-05-08,"Passion, Purpose, and Meaning at Work",487,487,0
19,6,2026-05-09,"Promotions, Recognition, and Getting Ahead",487,487,0
19,7,2026-05-10,When Work Stops Fitting,502,502,0
20,1,2026-05-11,Why So Many Meetings Fail,436,436,0
20,2,2026-05-12,Running a Good Meeting,451,451,0
20,3,2026-05-13,Collaboration and the Art of Working Together,466,466,0
20,4,2026-05-14,Creative Work in Groups,460,460,0
20,5,2026-05-15,Disagreement and Decision-Making,484,484,0
20,6,2026-05-16,Communicating Up and Across,439,439,0
20,7,2026-05-17,Building a Culture of Feedback,442,442,0
21,1,2026-05-18,Under Pressure: Managing Stress at Work,315,315,0
21,2,2026-05-19,What Pressure Does to Your Thinking,321,321,0
21,3,2026-05-20,Prioritizing When Everything Feels Urgent,330,330,0
21,4,2026-05-21,How to Ask for Help Before It Is Too Late,340,340,0
21,5,2026-05-22,Recovering After a High-Pressure Week,332,332,0
21,6,2026-05-23,Leading Others Through Pressure,340,340,0
21,7,2026-05-24,A Healthier Relationship With Pressure,370,370,0
22,1,2026-05-25,Figuring It Out: How We Tackle Problems,352,352,0
22,2,2026-05-26,How You Approach a Difficult Problem,348,348,0
22,3,2026-05-27,Creative Solutions and Fresh Thinking,374,374,0
22,4,2026-05-28,When the Real Problem Is Hidden,379,379,0
22,5,2026-05-29,Making Better Decisions When the Answer Is Unclear,379,379,0
22,6,2026-05-30,Solving Problems Better as a Team,353,353,0
22,7,2026-05-31,What Better Problem Solving Feels Like,369,369,0
23,1,2026-06-01,Where I'm Headed: Talking About Career Ambitions,377,377,0
23,2,2026-06-02,What Success Looks Like to You,354,354,0
23,3,2026-06-03,Ambition and Its Tradeoffs,361,361,0
23,4,2026-06-04,How to Talk About Your Next Step,407,407,0
23,5,2026-06-05,Choosing Between Stability and Growth,375,375,0
23,6,2026-06-06,Revising Your Goals Without Feeling Lost,393,393,0
23,7,2026-06-07,Building a Career That Still Feels Like Yours,398,398,0
24,1,2026-06-08,Always Learning: How We Grow and Improve,398,398,0
24,2,2026-06-09,Why Growth Requires Discomfort,396,396,0
24,3,2026-06-10,Learning New Skills as an Adult,399,399,0
24,4,2026-06-11,What Good Practice Actually Looks Like,405,405,0
24,5,2026-06-12,When Progress Feels Slow,401,401,0
24,6,2026-06-13,Learning From Other People Without Comparing Yourself,414,414,0
24,7,2026-06-14,What It Means to Keep Growing,414,414,0
25,1,2026-06-15,Wins and Losses: What We Learn From Both,408,408,0
25,2,2026-06-16,What Success Costs and What It Gives,403,403,0
25,3,2026-06-17,"Failure, Shame, and Starting Again",428,428,0
25,4,2026-06-18,The Pressure to Succeed in Public,412,412,0
25,5,2026-06-19,When Plans Fail but Life Does Not,440,440,0
25,6,2026-06-20,The Success That No One Sees,397,397,0
25,7,2026-06-21,A Healthier Way to Keep Going,424,424,0
26,1,2026-06-22,On and Off: Finding Balance Between Work and Rest,470,470,0
26,2,2026-06-23,How Work Follows You Home,492,492,0
26,3,2026-06-24,Rest Without Guilt,482,482,0
26,4,2026-06-25,"Boundaries at Work, Not Just After Work",510,510,0
26,5,2026-06-26,What Hobbies Give Back to Working Adults,491,491,0
26,6,2026-06-27,When Work Becomes Too Much of Who You Are,492,492,0
26,7,2026-06-28,A More Sustainable Way to Work and Live,521,521,0
27,1,2026-06-29,Going Somewhere: The Joy and Challenge of Travel,358,358,0
27,2,2026-06-30,Why Travel Changes Your Perspective,360,360,0
27,3,2026-07-01,Planning vs. Spontaneity on a Trip,359,359,0
27,4,2026-07-02,Traveling on a Budget Without Losing the Experience,389,389,0
27,5,2026-07-03,Culture Shock and How to Handle It,390,390,0
27,6,2026-07-04,Traveling With Other People,384,384,0
27,7,2026-07-05,Coming Home After a Trip,404,404,0
28,1,2026-07-06,Seeing and Capturing: Photography and Visual Creativity,420,420,0
28,2,2026-07-07,Why People Take Photos,435,435,0
28,3,2026-07-08,"Composition, Light, and Learning to See",417,417,0
28,4,2026-07-09,"Editing, Selection, and What to Leave Out",448,448,0
28,5,2026-07-10,"Drawing, Visual Journaling, and Creative Healing",443,443,0
28,6,2026-07-11,Creating in the Age of Social Media,408,408,0
28,7,2026-07-12,What Visual Art Teaches About Life,444,444,0
29,1,2026-07-13,"What We Listen To: Music, Podcasts, and Audio",393,393,0
29,2,2026-07-14,How Music Shapes Mood,367,367,0
29,3,2026-07-15,Musical Taste and Personal Identity,402,402,0
29,4,2026-07-16,"Podcasts, Learning, and the New Intimacy of Audio",397,397,0
29,5,2026-07-17,How Audio Fills Our Empty Time,380,380,0
29,6,2026-07-18,Shared Listening and Social Connection,404,404,0
29,7,2026-07-19,Listening With More Intention,445,445,0
30,1,2026-07-20,Words and Pages: Our Love of Reading and Writing,436,436,0
30,2,2026-07-21,Why Reading Slows the Mind Down,435,435,0
30,3,2026-07-22,Building a Reading Habit That Lasts,470,470,0
30,4,2026-07-23,"Journaling, Notes, and Writing for Yourself",462,462,0
30,5,2026-07-24,Why Writing Is Hard and Why It Matters,492,492,0
30,6,2026-07-25,"Books, Solitude, and the Inner Life",491,491,0
30,7,2026-07-26,What a Life With Books and Words Can Give You,513,513,0
31,1,2026-07-27,"Animal Companions: Pets, Wildlife, and Our Bond With Animals",474,474,0
31,2,2026-07-28,Why People Love Animals So Much,490,490,0
31,3,2026-07-29,What Caring for a Pet Teaches You,512,512,0
31,4,2026-07-30,"Wild Animals, Awe, and Conservation",482,482,0
31,5,2026-07-31,Animal Welfare and the Ethics of Care,486,486,0
31,6,2026-08-01,What Animals Teach Us About Ourselves,510,510,0
31,7,2026-08-02,Living More Gently in a Shared World,504,504,0
32,1,2026-08-03,"Things We Love: Hobbies, Collections, and Passions",502,502,0
32,2,2026-08-04,Why People Collect Things,489,489,0
32,3,2026-08-05,Hobbies as Relief From Hustle Culture,512,512,0
32,4,2026-08-06,Learning Through Hobbies and Slow Skill-Building,499,499,0
32,5,2026-08-07,Niche Interests and Finding Your People,486,486,0
32,6,2026-08-08,The Beauty of Doing Something Just for Yourself,494,494,0
32,7,2026-08-09,What Passion Adds to an Adult Life,517,517,0
33,1,2026-08-10,"Into the Open: Nature, Fresh Air, and the Outdoors",521,521,0
33,2,2026-08-11,Why Nature Changes the Way We Feel,496,496,0
33,3,2026-08-12,Urban Nature and Small Outdoor Rituals,541,541,0
33,4,2026-08-13,"Hiking, Difficulty, and the Value of Effort",543,543,0
33,5,2026-08-14,"Children, Screens, and Nature Deprivation",478,478,0
33,6,2026-08-15,"Travel, Tourism, and Protecting Fragile Places",505,505,0
33,7,2026-08-16,Living Closer to the Living World,535,535,0
34,1,2026-08-17,"Moving Your Body: Sports, Exercise, and Staying Active",488,488,0
34,2,2026-08-18,Why People Exercise for Different Reasons,508,508,0
34,3,2026-08-19,Finding Exercise You Will Actually Keep Doing,501,501,0
34,4,2026-08-20,"Sportsmanship, Competition, and Character",492,492,0
34,5,2026-08-21,"Social Media, Body Image, and Fitness Pressure",499,499,0
34,6,2026-08-22,"Aging, Recovery, and Exercising for the Long Term",508,508,0
34,7,2026-08-23,A Better Relationship With Your Body,529,529,0
35,1,2026-08-24,Always On: Technology in Our Daily Lives,481,481,0
35,2,2026-08-25,"Notifications, Attention, and Daily Focus",511,511,0
35,3,2026-08-26,Convenience and the Hidden Costs of Tech,495,495,0
35,4,2026-08-27,Smart Homes and Digital Habits,467,467,0
35,5,2026-08-28,When Technology Feels Overwhelming,495,495,0
35,6,2026-08-29,Choosing What Technology Is Worth Keeping,521,521,0
35,7,2026-08-30,Building a Healthier Relationship with Devices,526,526,0
36,1,2026-08-31,Intelligent Machines: Living With AI,511,511,0
36,2,2026-09-01,What AI Is Good At and What It Is Not,488,488,0
36,3,2026-09-02,How AI Changes Everyday Work,528,528,0
36,4,2026-09-03,"Trust, Accuracy, and Human Judgment",517,517,0
36,5,2026-09-04,Creative Work in the Age of AI,541,541,0
36,6,2026-09-05,"Ethics, Bias, and Responsibility",525,525,0
36,7,2026-09-06,Living Alongside Smarter Machines,536,536,0
37,1,2026-09-07,Mind and Body: Taking Care of Your Health,505,505,0
37,2,2026-09-08,What Mental Wellbeing Really Means,502,502,0
37,3,2026-09-09,"Stress, Anxiety, and Modern Life",516,516,0
37,4,2026-09-10,Small Habits That Protect Your Mind,529,529,0
37,5,2026-09-11,Talking More Honestly About Struggle,491,491,0
37,6,2026-09-12,"Rest, Therapy, and Support Systems",535,535,0
37,7,2026-09-13,Building a More Sustainable Inner Life,510,510,0
38,1,2026-09-14,Our Planet: Living Sustainably and Thinking Long-Term,490,490,0
38,2,2026-09-15,Why Environmental Issues Feel So Big,507,507,0
38,3,2026-09-16,Daily Choices and Their Real Impact,496,496,0
38,4,2026-09-17,"Convenience, Consumption, and Waste",511,511,0
38,5,2026-09-18,"Hope, Guilt, and Climate Emotions",559,559,0
38,6,2026-09-19,"Cities, Nature, and Sustainable Design",478,478,0
38,7,2026-09-20,What a Sustainable Future Could Look Like,501,501,0
39,1,2026-09-21,"Talking About Money: Goals, Habits, and Mindset",506,506,0
39,2,2026-09-22,What Money Means Beyond Numbers,515,515,0
39,3,2026-09-23,"Saving, Spending, and Personal Priorities",528,528,0
39,4,2026-09-24,Talking About Money with Other People,510,510,0
39,5,2026-09-25,Financial Goals and Emotional Pressure,507,507,0
39,6,2026-09-26,"Lifestyle, Status, and the Cost of Image",541,541,0
39,7,2026-09-27,A Healthier Relationship with Money,525,525,0
40,1,2026-09-28,Life in Motion: Navigating Change and New Chapters,564,564,0
40,2,2026-09-29,Why Change Feels Unsettling,551,551,0
40,3,2026-09-30,Life Transitions and Identity Shifts,598,598,0
40,4,2026-10-01,Starting Over in Midstream,547,547,0
40,5,2026-10-02,How to Adapt Without Losing Yourself,539,539,0
40,6,2026-10-03,Letting Go of What No Longer Fits,525,525,0
40,7,2026-10-04,Trusting Yourself Through Uncertainty,523,523,0
41,1,2026-10-05,"What We Stand For: Values, Principles, and Beliefs",446,446,0
41,2,2026-10-06,Where Our Values Come From,446,446,0
41,3,2026-10-07,When Beliefs Start to Change,472,472,0
41,4,2026-10-08,Living According to What You Believe,479,479,0
41,5,2026-10-09,Disagreeing with People You Respect,486,486,0
41,6,2026-10-10,What You Refuse to Compromise On,474,474,0
41,7,2026-10-11,Becoming More Thoughtful About What Matters,470,470,0
42,1,2026-10-12,"Looking Ahead: Hopes, Fears, and the Future",485,485,0
42,2,2026-10-13,Imagining the Future We Might Live In,483,483,0
42,3,2026-10-14,"Hope, Fear, and What Comes Next",505,505,0
42,4,2026-10-15,"Technology, Work, and the Near Future",503,503,0
42,5,2026-10-16,The Kind of Future People Want,487,487,0
42,6,2026-10-17,Planning for a Future You Cannot Fully Predict,505,505,0
42,7,2026-10-18,How Today Shapes Tomorrow,517,517,0
43,1,2026-10-19,Full Circle: Reflections on the Journey,469,469,0
43,2,2026-10-20,Looking Back on How Much You've Changed,480,480,0
43,3,2026-10-21,What the Hard Years Taught You,500,500,0
43,4,2026-10-22,The People and Moments That Shaped You,471,471,0
43,5,2026-10-23,"Regret, Gratitude, and Perspective",499,499,0
43,6,2026-10-24,What You Want to Leave Behind,483,483,0
43,7,2026-10-25,Moving Forward with More Intention,483,483,0
44,1,2026-10-26,Finding Your Creative Voice,500,500,0
44,2,2026-10-27,Art in Everyday Life,519,519,0
44,3,2026-10-28,Storytelling as a Human Need,499,499,0
44,4,2026-10-29,Design Thinking in Daily Life,498,498,0
44,5,2026-10-30,Music and Emotional Expression,514,514,0
44,6,2026-10-31,The Writer's Mind,508,508,0
44,7,2026-11-01,Living a Creative Life,512,512,0
45,1,2026-11-02,What Makes a Real Leader,513,513,0
45,2,2026-11-03,Influence Without Authority,510,510,0
45,3,2026-11-04,Emotional Intelligence in Leadership,496,496,0
45,4,2026-11-05,Building and Leading Teams,516,516,0
45,5,2026-11-06,Decision-Making Under Pressure,499,499,0
45,6,2026-11-07,Leading Yourself First,526,526,0
45,7,2026-11-08,Leadership in Everyday Life,533,533,0
46,1,2026-11-09,The Power of Community,536,536,0
46,2,2026-11-10,The Art of Listening,512,512,0
46,3,2026-11-11,Local Heroes and Changemakers,540,540,0
46,4,2026-11-12,Navigating Differences in Community,506,506,0
46,5,2026-11-13,Technology for Social Good,505,505,0
46,6,2026-11-14,Generations of Service,544,544,0
46,7,2026-11-15,This Week's Reflections,492,492,0
47,1,2026-11-16,"What Is Culture, Anyway?",530,530,0
47,2,2026-11-17,Navigating Cultural Differences at Work,501,501,0
47,3,2026-11-18,Food as a Cultural Gateway,543,543,0
47,4,2026-11-19,Traveling with Curiosity,521,521,0
47,5,2026-11-20,Values Across Cultures,529,529,0
47,6,2026-11-21,"Language, Translation, and Meaning",522,522,0
47,7,2026-11-22,Building Cultural Bridges,506,506,0
48,1,2026-11-23,Who Are You When You Speak?,523,523,0
48,2,2026-11-24,"Slang, Jargon, and Belonging",485,485,0
48,3,2026-11-25,Bilingual Lives,560,560,0
48,4,2026-11-26,Storytelling and Narrative Identity,556,556,0
48,5,2026-11-27,Words That Shape Thinking,568,568,0
48,6,2026-11-28,Writing and Self-Expression,555,555,0
48,7,2026-11-29,The Gift of Expression,565,565,0
49,1,2026-11-30,Why Rest Is Productive,495,495,0
49,2,2026-12-01,The Art of Doing Nothing,526,526,0
49,3,2026-12-02,Sabbath and Sacred Rest,520,520,0
49,4,2026-12-03,Creative Renewal,535,535,0
49,5,2026-12-04,Physical Renewal and Body Wisdom,525,525,0
49,6,2026-12-05,Slow Living in a Fast World,536,536,0
49,7,2026-12-06,A Week of Rest Reflections,541,541,0
50,1,2026-12-07,The Science of Gratitude,551,551,0
50,2,2026-12-08,Appreciating People in Your Life,544,544,0
50,3,2026-12-09,Finding Beauty in Ordinary Life,520,520,0
50,4,2026-12-10,Gratitude and Perspective,555,555,0
50,5,2026-12-11,Gratitude at Work,521,521,0
50,6,2026-12-12,Gratitude Across Cultures,516,516,0
50,7,2026-12-13,A Week of Thankfulness,512,512,0
51,1,2026-12-14,What Do You Really Want?,386,386,0
51,2,2026-12-15,The Vision Behind the Goal,403,403,0
51,3,2026-12-16,"Habits, Systems, and Daily Practice",429,429,0
51,4,2026-12-17,"Work, Purpose, and Calling",434,434,0
51,5,2026-12-18,Resilience and Bouncing Back,436,436,0
51,6,2026-12-19,The Year Ahead,469,469,0
51,7,2026-12-20,Setting Yourself Up for a Great Year,458,458,0
52,1,2026-12-21,Looking Back to Move Forward,415,415,0
52,2,2026-12-22,Relationships and Connections,429,429,0
52,3,2026-12-23,Health and Energy in Review,435,435,0
52,4,2026-12-24,Work and Purpose Review,466,466,0
52,5,2026-12-25,Growth and Learning This Year,442,442,0
52,6,2026-12-26,Creativity and Joy in Review,450,450,0
52,7,2026-12-27,A Letter to Your Future Self,462,462,0
53,1,2026-12-28,The Threshold,481,481,0
53,2,2026-12-29,Letting Go to Move Forward,497,497,0
53,3,2026-12-30,Designing the Year Ahead,482,482,0
53,4,2026-12-31,The Last Day and the First Step,492,492,0
